{
  "$schema": "https://json-schema.org/draft/2020-12/schema",
  "catalogVersion": "1.2.0",
  "generatedOn": "2026-09-01",
  "purpose": "Authoritative v2 mapping from each customer requirement to its implementation mechanism (Azure Policy built-in/custom definition or initiative, Entra/PIM artifact, Defender CSPM/CIEM feature, shared-service architecture pattern, or manual evidence process) before v2 policy code is expanded. Sourced from public Microsoft Learn and the Azure/azure-policy GitHub repository; no tenant credentials were used.",
  "sourceIssue": "https://github.com/johnstel/azureeslzmultisubdemo/issues/3",
  "classificationValues": [
    "azure-policy",
    "entra-pim",
    "defender-cspm-ciem",
    "shared-service-architecture",
    "manual-evidence"
  ],
  "enforcementPhaseValues": [
    "audit-only",
    "deny-do-not-enforce",
    "deployifnotexists-opt-in",
    "manual-evidence"
  ],
  "cautions": [
    "Azure service security baselines (for example, the Storage, Key Vault, or Compute security baselines) are Microsoft Learn guidance mapped into individual service controls; they are not one universal assignable Azure Policy initiative. See REQ-BASE-04.",
    "NERC CIP has no single turnkey built-in Azure Policy initiative. Compliance requires customer-owned evidence, a registered-entity applicability decision, and procedural controls outside Azure Policy. See REQ-CIP-01 and REQ-CIP-02. This catalog and repository do not claim NERC CIP certification or compliance.",
    "The Microsoft cloud security benchmark (REQ-BASE-01) initiative GUID is updated in place very frequently; always re-fetch the current metadata.version immediately before assignment rather than relying on the version recorded here. A separate, distinct \"Microsoft cloud security benchmark v2\" initiative also exists (GUID `e3ec7e09-768c-4b64-882c-fcada3772047`, 730 members); this catalog tracks v1 and v2 should be independently re-verified before any future switch.",
    "MCSB (REQ-BASE-01) and CIS (REQ-BASE-02) were checked for remediation-capable (DeployIfNotExists/Modify) policies using a reproducible per-member effect-mapping method (validating that each member's effect-named parameter references an existing top-level initiative parameter). CIS's 2 fixed/unmapped members (of 108 total) were both individually fetched and confirmed Audit-effect, so CIS's `remediationIdentityRequired: false` is fully evidence-backed. MCSB's 56 fixed/unmapped members (of 226 total) were each individually resolved to their source filename in the public Azure/azure-policy repository and every one follows the Azure Policy naming convention for a fixed, non-remediating effect (`_Audit`, `_Deny`, `_AuditDeny`, or `_AINE`/AuditIfNotExists) with none using the DeployIfNotExists/Modify remediation-policy naming convention -- an exhaustive 56-of-56 verification, so MCSB's `remediationIdentityRequired: false` is also fully evidence-backed. NIST SP 800-53 Rev. 5 (REQ-BASE-03) has 616 fixed/unmapped members (of 694 total) using opaque GUID reference IDs that cannot be corroborated by naming convention; this session independently resolved all 616 by shallow-cloning the public Azure/azure-policy repository and building a GUID-to-effect index from each member's own fixed effect (or its parameter's default when the effect itself is parameterized with no initiative-level override), yielding an exact, independently-verified breakdown of 481 Manual, 97 AuditIfNotExists, 34 Audit, 2 Modify, and 2 DeployIfNotExists. The 4 Modify/DeployIfNotExists members (the Guest Configuration prerequisite policies) each require only the Contributor role (`b24988ac-6180-42a0-ab88-20f7382dd24c`), independently confirmed from their own definition JSON -- so unlike MCSB/CIS, REQ-BASE-03's `enforcementPhase` is `deployifnotexists-opt-in` (not `audit-only`) and its `supportedEffects` includes `AuditIfNotExists`/`DeployIfNotExists`/`Modify`/`Manual` to reflect these fixed members, since assigning the initiative at all unavoidably enables the remediation-capable ones. A separate, newer \"NIST SP 800-53 R5.1.1\" initiative also exists (GUID `60205a79-6280-4e20-a147-e2011e09dc78`) for the updated revision. See each record's `notes` field for the full verification method and its limits.",
    "REQ-DEF-01 (\"Configure Microsoft Defender for Cloud plans\") is an all-or-nothing initiative: it exposes no assignment-time parameters, so assigning it enables all 12 member Defender plans immediately with no per-plan opt-out. It is **not safe** for this repository's audit-first/no-cost demo default profile and is documented for completeness only. Each plan must instead be independently enabled via its own verified, individually assignable policy definition (REQ-DEF-02 through REQ-DEF-04), which does expose its own `effect` parameter (`DeployIfNotExists`/`Disabled`) that can be explicitly overridden at assignment time. REQ-DEF-01's `roleDefinitionIds` remains a complete verified union (Owner + Security Admin) across all 12 members (`rolesVaryByMember: true`) for reference only.",
    "REQ-LOG-02's `roleDefinitionIds` was exhaustively verified across all 140 members to be Log Analytics Contributor only (`rolesVaryByMember: false`).",
    "REQ-DEF-06 is a no-cost audit signal from the free Foundational CSPM tier. It does not deploy a vulnerability scanner or enable any paid Defender plan.",
    "REQ-BKP-03 is a customer-input record; REQ-BKP-04 through REQ-BKP-06 are audit-only; and REQ-BKP-07 remediation remains explicit opt-in. Safe defaults create no vault, backup policy, diagnostic setting, private endpoint, encryption key, or protection relationship.",
    "Customer-managed key (CMK) controls (REQ-DATA-08, REQ-DATA-09, REQ-DATA-13) are service-specific and audit-first, never a blanket deny across every Azure service. Using a CMK adds customer-owned dependencies that Azure Policy cannot satisfy: a managed identity with get/wrapKey/unwrapKey access to the key, a key rotation process, key availability (a deleted, disabled, expired, or purged key makes the encrypted data unreadable), soft delete and purge protection for recovery (REQ-DATA-05 and REQ-DATA-06; purge protection must never be disabled once enabled), and private-network reachability of the vault when public network access is restricted (REQ-DATA-11 audits vault network configuration and REQ-NET-04/REQ-NET-05 audit private-link readiness; none of them deploy a private endpoint, DNS zone, key, or identity)."
  ],
  "controls": [
    {
      "id": "REQ-ID-01",
      "domain": "identity",
      "customerRequirement": "Require phishing-resistant MFA for privileged Entra roles.",
      "scope": "tenant (Entra ID)",
      "classification": "entra-pim",
      "mechanism": {
        "kind": "conditional-access-template",
        "builtIn": false,
        "displayName": "Conditional Access: privileged-role phishing-resistant MFA (report-only template)",
        "sourceUrl": "https://learn.microsoft.com/en-us/entra/identity/conditional-access/policy-admin-phish-resistant-mfa",
        "verifiedOn": "2026-09-01",
        "verificationMethod": "ms-learn-page"
      },
      "supportedEffects": [
        "reportOnly",
        "enabledEnforced"
      ],
      "requiredParameters": [
        "targetRoleGroupObjectIds",
        "emergencyAccessExclusionObjectIds"
      ],
      "roleDefinitionIds": [],
      "remediationIdentityRequired": false,
      "dependencies": [],
      "enforcementPhase": "manual-evidence",
      "evidenceSource": "Entra Conditional Access policy JSON export (report-only) tracked in repository identity artifacts (issue #2).",
      "notes": "Not implementable with Azure Policy; requires Microsoft Graph/Entra ID configuration outside this repository's automated scope."
    },
    {
      "id": "REQ-ID-02",
      "domain": "identity",
      "customerRequirement": "Require MFA for any access to Azure management (Azure Resource Manager).",
      "scope": "tenant (Entra ID)",
      "classification": "entra-pim",
      "mechanism": {
        "kind": "conditional-access-template",
        "builtIn": false,
        "displayName": "Conditional Access: require MFA for Azure Management (report-only template)",
        "sourceUrl": "https://learn.microsoft.com/en-us/entra/identity/conditional-access/howto-conditional-access-policy-azure-management",
        "verifiedOn": "2026-08-31",
        "verificationMethod": "documentation-pattern"
      },
      "supportedEffects": [
        "reportOnly",
        "enabledEnforced"
      ],
      "requiredParameters": [
        "emergencyAccessExclusionObjectIds"
      ],
      "roleDefinitionIds": [],
      "remediationIdentityRequired": false,
      "dependencies": [],
      "enforcementPhase": "manual-evidence",
      "evidenceSource": "Entra Conditional Access policy JSON export (report-only) tracked in repository identity artifacts (issue #2).",
      "notes": "Not implementable with Azure Policy; requires Entra Conditional Access."
    },
    {
      "id": "REQ-ID-03",
      "domain": "identity",
      "customerRequirement": "Block legacy (basic) authentication protocols.",
      "scope": "tenant (Entra ID)",
      "classification": "entra-pim",
      "mechanism": {
        "kind": "conditional-access-template",
        "builtIn": false,
        "displayName": "Conditional Access: block legacy authentication (report-only template)",
        "sourceUrl": "https://learn.microsoft.com/en-us/entra/identity/conditional-access/policy-block-legacy-authentication",
        "verifiedOn": "2026-08-31",
        "verificationMethod": "documentation-pattern"
      },
      "supportedEffects": [
        "reportOnly",
        "enabledEnforced"
      ],
      "requiredParameters": [
        "emergencyAccessExclusionObjectIds"
      ],
      "roleDefinitionIds": [],
      "remediationIdentityRequired": false,
      "dependencies": [],
      "enforcementPhase": "manual-evidence",